{
  "$schema": "https://json-schema.org/draft/2020-12/schema",
  "$id": "https://vantage-platform.io/prysm/contracts/v1/audit-request.schema.json",
  "title": "Audit Request",
  "description": "Validated intake payload that starts a Prysm audit. Schema version 1.0.0.",
  "type": "object",
  "version": "1.0.0",
  "contractVersion": "1.0.0",
  "additionalProperties": false,
  "required": [
    "auditId",
    "tenantId",
    "clientId",
    "idempotencyKey",
    "targetUrl",
    "contractVersion"
  ],
  "properties": {
    "contractVersion": {
      "type": "string",
      "const": "1.0.0",
      "description": "Contract version — must match the schema version."
    },
    "auditId": {
      "type": "string",
      "format": "uuid",
      "description": "Unique audit identifier assigned at intake."
    },
    "tenantId": {
      "type": "string",
      "minLength": 1,
      "description": "Owning tenant identifier."
    },
    "clientId": {
      "type": "string",
      "minLength": 1,
      "description": "Client identifier within the tenant."
    },
    "idempotencyKey": {
      "type": "string",
      "minLength": 8,
      "maxLength": 256,
      "description": "Client-supplied key that prevents duplicate audit creation."
    },
    "targetUrl": {
      "type": "string",
      "format": "uri",
      "pattern": "^https?://",
      "description": "Normalized target website URL."
    },
    "businessName": {
      "type": "string",
      "maxLength": 256,
      "description": "Client-facing business name."
    },
    "market": {
      "type": "string",
      "maxLength": 128,
      "description": "Primary market or location string (e.g. city and region)."
    },
    "language": {
      "type": "string",
      "pattern": "^[a-z]{2}(-[A-Z]{2})?$",
      "default": "en-CA",
      "maxLength": 10,
      "description": "BCP 47 language tag for the report."
    },
    "primaryGoal": {
      "type": "string",
      "maxLength": 256,
      "description": "Primary business goal for this audit."
    },
    "services": {
      "type": "array",
      "maxItems": 20,
      "items": {
        "type": "string",
        "maxLength": 128
      },
      "description": "Service lines or offerings."
    },
    "competitors": {
      "type": "array",
      "maxItems": 3,
      "items": {
        "type": "string",
        "format": "uri",
        "pattern": "^https?://"
      },
      "description": "Up to three competitor URLs."
    },
    "ga4": {
      "type": "object",
      "properties": {
        "propertyId": {
          "type": "string",
          "pattern": "^[0-9]+$",
          "description": "Google Analytics 4 property ID (digits only)."
        },
        "serviceAccountJson": { "type": "string" },
        "oauthService": {},
        "fetchImpl": {}
      },
      "description": "Optional GA4 property selection. oauthService/fetchImpl are controlled-dependency injection seams (tests only)."
    },
    "gsc": {
      "type": "object",
      "properties": {
        "siteUrl": {
          "type": "string",
          "description": "Google Search Console site URL or sc-domain property."
        },
        "serviceAccountJson": { "type": "string" },
        "oauthService": {},
        "fetchImpl": {},
        "sufficiencyThreshold": { "type": "integer", "minimum": 1 }
      },
      "description": "Optional GSC property selection. oauthService/fetchImpl are controlled-dependency injection seams (tests only)."
    },
    "crawl": {
      "type": "object",
      "properties": {
        "maxPages": {
          "type": "integer",
          "minimum": 1,
          "maximum": 10000,
          "default": 250
        },
        "enableJavascript": {
          "type": "boolean",
          "default": false
        },
        "includePatterns": {
          "type": "array",
          "items": { "type": "string" }
        },
        "excludePatterns": {
          "type": "array",
          "items": { "type": "string" }
        },
        "pollTimeoutMs": { "type": "integer", "minimum": 1 },
        "pollIntervalMs": { "type": "integer", "minimum": 1 },
        "resumeTaskId": { "type": "string" },
        "enableContentParsing": {
          "type": "boolean",
          "default": true,
          "description": "PRYSM-NEXT-01 WP-B: enable DFS content parsing at task level. Requests are scoped to the deterministic key-page set only."
        },
        "validateMicromarkup": {
          "type": "boolean",
          "default": true,
          "description": "PRYSM-NEXT-01 WP-B: enable DFS micromarkup validation so the microdata endpoint returns structured data."
        },
        "contentParsingPageLimit": {
          "type": "integer",
          "minimum": 1,
          "maximum": 50,
          "default": 50,
          "description": "PRYSM-NEXT-01 WP-B: runtime budget for governed task-scoped Content Parsing pages."
        },
        "redirectChainsPageLimit": {
          "type": "integer",
          "minimum": 1,
          "maximum": 200,
          "default": 20,
          "description": "PRYSM-NEXT-01 WP-B: max pages checked for redirect chains (key pages + 3xx pages)."
        },
        "nonIndexableLimit": {
          "type": "integer",
          "minimum": 1,
          "maximum": 5000,
          "default": 1000,
          "description": "PRYSM-NEXT-01 WP-B: max non-indexable page records collected."
        },
        "resourcesPageLimit": {
          "type": "integer",
          "minimum": 1,
          "maximum": 50,
          "default": 10,
          "description": "PRYSM-NEXT-01 WP-B: max key pages inspected for resource/broken-resource evidence."
        },
        "pathValidationEnabled": {
          "type": "boolean",
          "default": true,
          "description": "PRYSM-NEXT-01 WP-E: enable the narrow Playwright conversion-path validation layer (read-only; never submits)."
        },
        "pathValidationPageLimit": {
          "type": "integer",
          "minimum": 1,
          "maximum": 20,
          "default": 6,
          "description": "PRYSM-NEXT-01 WP-E: max key pages browser-validated."
        },
        "pathValidationScreenshots": {
          "type": "boolean",
          "default": true,
          "description": "PRYSM-NEXT-01 WP-E: capture controlled desktop screenshots into governed evidence artifacts."
        },
        "pathValidationMobile": {
          "type": "boolean",
          "default": true,
          "description": "PRYSM-NEXT-01 WP-E: run the mobile viewport pass."
        },
        "pathValidationLiveBrowser": {
          "type": "boolean",
          "default": false,
          "description": "PRYSM-NEXT-01 WP-E: explicit production opt-in to launch a real browser. Default false — controlled tests never launch browsers."
        },
        "fixtures": {},
        "fetchImpl": {},
        "localRunner": {}
      },
      "description": "Crawl configuration overrides. fixtures/fetchImpl/localRunner are controlled-dependency injection seams (tests only); production defaults are unchanged."
    },
    "performance": {
      "type": "object",
      "properties": {
        "pagespeedApiKey": { "type": "string" },
        "cruxApiKey": { "type": "string" },
        "lighthouseTimeoutMs": { "type": "integer", "minimum": 1 },
        "fetchImpl": {},
        "localRunner": {}
      },
      "description": "Performance configuration. fetchImpl/localRunner are controlled-dependency injection seams (tests only)."
    },
    "serp": {
      "type": "object",
      "properties": {
        "fetchImpl": {}
      },
      "description": "SERP configuration. fetchImpl is a controlled-dependency injection seam (tests only)."
    },
    "backlinks": {
      "type": "object",
      "properties": {
        "fetchImpl": {}
      },
      "description": "Backlinks configuration. fetchImpl is a controlled-dependency injection seam (tests only)."
    },
    "report": {
      "type": "object",
      "properties": {
        "designVersion": {
          "type": "string",
          "enum": ["1.0.0", "2.0.0"],
          "default": "1.0.0",
          "description": "PRYSM-NEXT-01 WP-G: governed report design version. 1.0.0 = locked v1 design (default); 2.0.0 = prysm-report-design-v2.0.0."
        },
        "narrativeVersion": {
          "type": "string",
          "enum": ["1.0.0", "2.0.0"],
          "default": "1.0.0",
          "description": "PRYSM Narrative v2 production-path gate. 1.0.0 keeps the existing narrative/render path; 2.0.0 explicitly selects the governed Writer/Judge narrative layer when the runtime capability is enabled."
        },
        "snapshotVersion": {
          "type": "string",
          "enum": ["1.0.0"],
          "default": "1.0.0",
          "description": "PRYSM Snapshot V1 client-facing report selection. New audits default to the governed one-page Snapshot while the Executive Report remains separately addressable."
        }
      },
      "description": "Report configuration. Snapshot V1 is the default client-facing output; Executive Report design and narrative versions remain independently governed."
    }
  }
}
