{"contractVersion":"1.0.0","auditId":"9714c206-8ed3-4686-8fe2-ceeca0ca0f82","tenantId":"omnipressence","clientId":"www.tbkcreative.com-tbkcreative","idempotencyKey":"web:9714c206-8ed3-4686-8fe2-ceeca0ca0f82","targetUrl":"https://www.tbkcreative.com/","businessName":"Tbkcreative","market":"London, Ontario, Canada","language":"en-CA","primaryGoal":"Generate qualified enquiries","services":["Custom Websites","Digital Marketing","SEO","Branding","Custom Software"],"competitors":["https://red-rhino.com","https://www.northern.co","https://www.zoomedia.ca"],"report":{"designVersion":"2.0.0","narrativeVersion":"2.0.0"},"crawl":{"pathValidationLiveBrowser":true}}