{"contractVersion":"1.0.0","auditId":"97d6b2c7-03b9-4530-8ea7-16557502c638","tenantId":"omnipressence","clientId":"rebootbusinesscoaching.com-rebootbusinesscoaching","idempotencyKey":"web:97d6b2c7-03b9-4530-8ea7-16557502c638","targetUrl":"https://rebootbusinesscoaching.com/","businessName":"Rebootbusinesscoaching","market":"Canada","language":"en-CA","primaryGoal":"Generate qualified enquiries","services":["4-Week Reboot Series","Group Coaching","Individual Coaching","One-Page Business Planning"],"competitors":["https://ginakeeping.ca/","https://traceyjazmin.com/","https://clarityofgoalsandvision.com/"],"report":{"designVersion":"2.0.0","narrativeVersion":"2.0.0"}}